,property_url,headline,price,area,description,amenities
74,https://www.homeaway.com/vacation-rental/p356484#reviews,"Downtown Digs for the Erudite Urbanite. A clean, cool, convenient mondo condo.",$133,500 sq. ft.,"Relax in Downtown Austin and the best kind of urban life! This rare property offers a unique combination of neighborhood charm, privacy and downtown access at a tremendous value. The highly walkable location puts you in the heart of Austin's acclaimed outdoor activities and nightlife, yet comfortably distanced from the fray. You'll appreciate the simple, well appointed modern design and perfect use of space.","Satellite or Cable, Washer & Dryer, No Smoking, Air Conditioning, TV, Internet, Heater, Parking"
75,https://www.homeaway.com/vacation-rental/p293833#reviews,One Bedroom in the Trees 1/2 Block from Barton Springs,$138,1049 sq. ft.,"Explore Zilker Park from your front door. This architect designed 1955 duplex is built into a hillside with terraced gardens out your front windows and treetops out the back. At 1050 square feet this first floor 1 bedroom is spacious! An easy walk to restaurants, coffee shops, live music venues and all that makes Austin special. Downtown Austin is less than a mile away, an easy walk or bike ride on the lovely hike and bike trail.","Internet, Air Conditioning, TV, Satellite or Cable, Washer & Dryer, Children Welcome, Parking, No Smoking, Heater"
76,https://www.homeaway.com/vacation-rental/p3620287#reviews,3BR/2.5BA North Austin Retreat with Pool and Spa,$227,2600 sq. ft.,"Our 3BR/2 ½ BR home sleeps six with king size beds in two of the bedrooms and a twin sleigh bed/trundle. Both guestrooms are located on the 2nd level of the house. The home features wood, concrete, tile and carpet flooring throughout with trendy and comfortable décor. The chef’s quality kitchen features a gas stove top, convection oven and auxiliary oven and granite countertops. Watch the game in the family room on the 60” TV or catch a movie on Netflix. HBO, Cinemax and other premium movie channels are also available; as well as music channels for your entertainment. Enjoy the master bedroom with its king size bed, flat screen TV with DVD player, walk in closet and its very own private bath with slate tile floors and large tile shower. There is a powder room and laundry room located just off the kitchen. The laundry room has a front loading washer and dryer with a folding area above. Take advantage of the large backyard where you can cook in the outdoor kitchen, enjoy the pool, listen to the waterfall, relax in the spa, have dinner alfresco under the arbor or warm up by the fire pit.","Swimming pool, Internet, Air Conditioning, Hot Tub, Fireplace, TV, Satellite or Cable, Washer & Dryer, No Smoking"
77,https://www.homeaway.com/vacation-rental/p3469874#reviews,Fantastic SOCO Studio,$96,500 sq. ft.,"Absolutely adorable former photo studio, now a brand new vacation rental. Located in the hippest part of town – SOCO (South Congress) with great access to everything that's best about Austin--shopping, restaurants, bars, and major music events.","Internet, Air Conditioning, Pets Welcome, TV, Satellite or Cable, Parking, No Smoking, Heater"
78,https://www.homeaway.com/vacation-rental/p3655608#reviews,"Comfortable, Private Yard, In The Heart Of Austin",$227,1750 sq. ft.,License # 2014033175,"Internet, Air Conditioning, TV, Satellite or Cable, Washer & Dryer, Children Welcome, Parking, No Smoking, Heater"
79,https://www.homeaway.com/vacation-rental/p203533vb#reviews,Centrally Located Treehouse Studio Apt,$92,450 sq. ft.,"Within walking distance of the University of Texas campus, St. David's Hospital and a wide variety of restaurants, our studio is located in a free-standing building behind our house. Our quaint neighborhood is in an older section of town, and is remarkably quiet for its central location. A longer walk or a short cab ride takes you to the State Capitol, downtown Austin, the Convention Center, the hike and bike trail, Barton Springs and many music venues.","Internet, Air Conditioning, TV, Satellite or Cable, Washer & Dryer, Children Welcome, Parking, No Smoking, Heater"
80,https://www.homeaway.com/vacation-rental/p316184vb#reviews,Inside Loop Central North Area UT/Downtown + Shopping Domain/Arbor/Allandale,$130,1400 sq. ft.,"Location, Location, Location. Central North close to the Domain and Arboretum, 27 Five Star, Mid-range and Fast Food restaurants within a mile.Pet and Smoke FREE. Read the Reviews. Families who book once book again and again. This home came into the VRBO program in 2010. Our guest love the location and amenities so much we have returning guests year after year. Families continue to come back for stays from two to four months because we work hard to make your trip relaxing and fun. Our property is exceptionally clean and located in the Heart of North Austin with wonderful major shopping centers such as The Domain; Arboretum; Gateway and a long list of 5 Star, Mid Range and fast food Restaurants, Organic Food Stores, Entertainment Venues, Big Box Stores and Expressways within 2 miles of our property. Please note, rates are subject to change without notice prior to a reservation. Once a reservation is accepted, your rate is fixed at the agreed price. We charge additional for more than four guests for a booking.","Internet, Air Conditioning, Fireplace, TV, Satellite or Cable, Washer & Dryer, Children Welcome, Parking, No Smoking, Accessible, Heater"
81,https://www.homeaway.com/vacation-rental/p3607280#reviews,The Mellow Yellow #1 - 2BR/1BA Updated Casita -Walk to South Lamar and Zilker,$118,800 sq. ft.,"2br/1ba rental located in lovely Zilker Neighborhood of South Central Austin, very close to downtown and with several options for eats and drinks. This lovely little casita is one of two rentals on the property, and sleeps four comfortably in beds.","Satellite or Cable, No Smoking, Pets Welcome, Washer & Dryer, Air Conditioning, TV, Children Welcome, Internet, Parking, Heater"
82,https://www.homeaway.com/vacation-rental/p272269vb#reviews,Waterfront Lake Austin Cottage:Close to Downtown/Kayaks/Paddle Boards/Boat Deck,$250,750 sq. ft.,"The waterfront cottage is on beautiful Lake Austin and only 10 minutes from downtown Austin. This is central to everything Austin has to offer, but on the lake!","Internet, Air Conditioning, Fireplace, TV, Satellite or Cable, Washer & Dryer, Children Welcome, Parking, No Smoking, Heater"
83,https://www.homeaway.com/vacation-rental/p204038#reviews,3BR/2.5BA Downtown Hilltop Home,$284,1500 sq. ft.,"You'll love staying at this house and now it is more affordable than ever. This 3BR/2.5BA modern designer space offers the complete Austin experience. Antique brick walkways and lighted landscaping lead to the house that offers three levels of living space and a fantastic rooftop deck overlooking the city. The house is just one mile from the Lady Bird Lake hike & bike trails and is within walking distance to all of the East Side’s premiere venues. You are a short 3-minute walk to local pubs, coffee shops, and a convenient store. Not to mention, our home is a 15 minute walk to East Austin Nightlife: White Horse,Volstead Lounge and Eastside Showroom. You are sure to enjoy all that Austin has to offer!","Internet, Air Conditioning, Pets Welcome, TV, Satellite or Cable, Washer & Dryer, No Smoking"
84,https://www.homeaway.com/vacation-rental/p1027340vb#reviews,Unique Walk Out Basement Studio In the Middle of SXSW East,$95,500 sq. ft.,"Stay in this light-filled basement apartment, and you can walk to all that downtown east has to offer and leave your car at home.","Internet, Air Conditioning, Pets Welcome, TV, Children Welcome, Parking, No Smoking, Heater"
85,https://www.homeaway.com/vacation-rental/p122063vb#reviews,Clarksville's Bungalow in the Trees,$95,,"Quietly nestled in the historic Clarksville section of Austin, our circa 1930's home offers a peaceful studio style apartment ready to be your space. Our apartment is unique in its incredible location [1/2 block off 6th Street] furnishing our guests a tranquil setting with downtown convenience. Being on the Dillo bus route, our visitors are a 5 minute ride from Congress/6th Street intersection...and a short walk through the neighborhood to great local restaurants on both West Lynn Street and West 6th.","Satellite or Cable, No Smoking, Air Conditioning, TV, Internet, Pets Welcome, Parking"
86,https://www.homeaway.com/vacation-rental/p234711vb#reviews,"Studio Gem Perfect for Twosome, Just South of Downtown",$109,550 sq. ft.,**SXSW lowdown **,"Internet, Air Conditioning, TV, Satellite or Cable, Parking, No Smoking, Heater"
87,https://www.homeaway.com/vacation-rental/p3466018#reviews,"Lake Austin Waterfront, 10 Minutes To Downtown Austin","$1,200",4386 sq. ft.,"Beautiful, newly remodeled 6 bedroom, 4 bathroom home with gorgeous Lake Austin water frontage. Also includes 3 common living areas, dining area, large laundry room facilities, home office and covered parking. 3 levels of expansive outdoor decks, furnished for outdoor living and dining to enjoy spectacular water and hill country views. Salt water pool and hot tub with waterfall. Waterfront features a large one-stall boat slip with deck above. Large lot, beautiful trees and landscape. The home is private and gated. Large, fully stocked kitchen perfect for family get aways and entertaining. Dramatic ceilings, lots of sunlight, marble bathrooms. Three king beds, three queen beds and two twin beds in an upstairs sleeping loft.","Swimming pool, Internet, Air Conditioning, Hot Tub, Fireplace, TV, Satellite or Cable, Washer & Dryer, Children Welcome, Parking, No Smoking, Heater"
88,https://www.homeaway.com/vacation-rental/p3015992#reviews,"Charming South Austin Home. Minutes from Downtown (ACL, SXSW, Formula 1)",$148,1600 sq. ft.,"Welcome to HQ Austin! (Lic. #OL2018046696) South Austin home in quiet neighborhood, 2 blocks from South Congress, with easy access to many restaurants and bars. 7 minutes down Congress and you're in the heart of SoCo with many bars and restaurants all in walking distance of each other. Downtown and 6th Street are just across the famous Congress Street bridge that houses the legendary bat population that draws thousands to see. 10 minutes to Austin-Bergstrom, 15 minutes to Zilker Park (ACL, SXSW) and Barton Springs Pool. Easy access to Formula 1 Circuit of the Americas. My place is great for couples, solo adventurers, or business travelers who want to mix business with exciting downtown Austin. HQ Austin has all the amenities of home including fully stocked kitchen and bathrooms, complimentary bottled water, juices, snacks, and coffee/tea.","Internet, Air Conditioning, TV, Satellite or Cable, Washer & Dryer, Parking, No Smoking, Heater"
89,https://www.homeaway.com/vacation-rental/p3511687#reviews,Huge Luxury Home in Best Neighborhood - Zilker,$893,3500 sq. ft.,"Location, location, Location! Easy access to downtown. Walkable to the coolest bars and restaurants in town and ACL Festival.","Satellite or Cable, No Smoking, Washer & Dryer, Air Conditioning, TV, Children Welcome, Internet, Parking, Heater, Fireplace, Swimming pool"
90,https://www.homeaway.com/vacation-rental/p213197vb#reviews,Charming Travis Heights Farmhouse in Central Austin (~SoCo~),$295,2100 sq. ft.,This wonderful house overlooks Stacey Park and is located in the coveted Travis Heights neighborhood of Austin.,"Internet, Air Conditioning, TV, Satellite or Cable, Washer & Dryer, Children Welcome, Parking, No Smoking, Heater"
91,https://www.homeaway.com/vacation-rental/p326996#reviews,"Sunny bright 2/1 w private Hot Tub, King/Queen bed. Walk to Lamar/Greenbelt",$171,1000 sq. ft.,Welcome to The Austinite!,"Internet, Air Conditioning, Hot Tub, TV, Washer & Dryer, Children Welcome, Parking, No Smoking, Heater"
92,https://www.homeaway.com/vacation-rental/p334861#reviews,2BR Welcome to Chill Ville- Austin's Hip New Hangout! Fall Discounts,$162,950 sq. ft.,"Looking for a place to ‘chill’ after a day of exploring Austin? Welcome to Chill-Ville, the newest 'burb of Austin. Our well-thought out house features a lovely open floor plan with beautiful floor to ceiling windows facing downtown, an expansive deck with grill and fan, great back yard, and comfortable sleeping arrangements for 4 adults with 1 queen and 2 twin beds. The open concept is throughout the house. The second bedroom is actually a living area that is closed off with privacy curtains. The floor plan allows for you to share space from the front door to the back porch. We invite you to come chill at our place!","No Smoking, Air Conditioning, Washer & Dryer, Satellite or Cable, TV, Internet, Parking"
93,https://www.homeaway.com/vacation-rental/p186314vb#reviews,Beautiful Montina Beach on Lake Travis - Walk to the Water!,$349,2005 sq. ft.,Montina Beach is one of a few properties on Lake Travis with a gradual slope to the water. The park like setting from the beach area has been described by a real estate appraiser as the 'FINEST LAND on Lake Travis.' The view looks out across one of the largest areas of the lake with some of the largest hills in the Texas Hill Country as the backdrop. You will find this lake front area much more scenic than anything in Lakeway due to the larger lake area and the bigger hills; and much closer to town/amenities than Briarcliff or Lago Vista.,"Washer & Dryer, No Smoking, Satellite or Cable, Children Welcome, TV, Pets Welcome, Internet, Air Conditioning, Heater, Parking"
94,https://www.homeaway.com/vacation-rental/p3478871#reviews,Downtown Gem. Dogs welcome. 30 day lease only. $0.99 lease break fee.,$144,1000 sq. ft.,"2 Bedroom, 1 Bath, living and living/dining area openly connected, with plenty of parking on property. 2 bicycles available.","No Smoking, Air Conditioning, Washer & Dryer, Satellite or Cable, TV, Children Welcome, Pets Welcome, Internet, Heater, Parking"
95,https://www.homeaway.com/vacation-rental/p3666817#reviews,"2 Room Suite In Beautiful Barton Hills-Perfect for SXSW, ACL and Barton Springs",$125,,"The perfect location for ACL, SXSW, F1 Circuit of the Americas, and FunFunFun Fest! Located in quiet Barton Hills in the ever-so-cool 78704 district, you’ll find many amenities and conveniences. Two miles from Zilker Park, Barton Springs Pool, Downtown, South Congress (SOCO) and 3 blocks from the nearest bus stop.","Internet, Air Conditioning, TV, Parking, No Smoking, Heater"
96,https://www.homeaway.com/vacation-rental/p368355#reviews,"Charming Cottage Near Downtown, UT, St. Eds & Soco, ACL & SXSW SPECIALS!",$200,1775 sq. ft.,"Located in trendy 78704 zip code. Fabulous location newly updated with wood floors,and new modern furnishings, full kitchen for home cooking and BBQ out back for grilling. Secure parking with off street parking for two additional cars.Three large bedrooms, master with king bed, and second bedroom has a queen bed. Warm living area with sofa and love seat for watching the 47 inch LG flatscreen TV with free cable and WIFI included.","Internet, Air Conditioning, TV, Satellite or Cable, Washer & Dryer, Children Welcome, Parking, Heater"
97,https://www.homeaway.com/vacation-rental/p3750562#reviews,Walk Downtown! 5 blocks to East 6th St! Modern Luxury Home,$450,2499 sq. ft.,"*Please inquire for current rates and availability - rates differ because of events, high demand weekends and holidays and are not always reflected on the website**Discounts for longer stays*","Internet, Air Conditioning, Pets Welcome, TV, Satellite or Cable, Washer & Dryer, Children Welcome, Parking, No Smoking, Heater"
98,https://www.homeaway.com/vacation-rental/p370200vb#reviews,ACL Available!| Downtown | Private Pool | 5 Bed./4 Bath,$925,3000 sq. ft.,"Location, Location, Location!! Easy access to Downtown for SXSW AND Walkable to Zilker Park (ACL festival) & Barton Springs!","Satellite or Cable, No Smoking, Pets Welcome, Washer & Dryer, Air Conditioning, TV, Children Welcome, Internet, Parking, Heater, Fireplace, Swimming pool"
99,https://www.homeaway.com/vacation-rental/p292796#reviews,"Sept through Nov. Beautiful time out here,",$214,1000 sq. ft.,"This Lake Austin Cabin is located on the prettiest part of Lake Austin (behind an electronic gate) with panoramic views of the lake and natural wildlife preserve across the way. Come relax, enjoy the beautiful scenery, lounge on the screened porch, lay on the deck, or walk over to the Lake Austin Spa for a day treatment or massage. Bring your boat; launch it at the ramp next door, park it overnight on our lift. Fish off of our docks and bulkhead; play on the inner tubes, read that book you have been wanting to read, or bring your art supplies. Boat slip can be rented per night; check with owner if you wish to bring boat. Check out our kayaks and canoe for your use at no charge, take a beautiful trip up the lake and come back and picnic on the private grounds. There is a charcoal barbecue pit right outside your cabin. Located close to some of the best restaurants, Steiner Ranch Steak House (usually requires a reservation during the weekend), Cafe Blue, Santa Catarina (great interior Mexican food and fabulous Margaritas), Saigon (Vietnamese/Thai), Los Pinos (authentic Mexican food), Lakeside Pizza Grill (great and very near the cabin) the famous Oasis Restaurant, with outstanding views, sunsets snd cocktails; only seven miles away on Lake Travis. We also have two other cabins on the property if you are want to bring more family and friends. Contact owner and she can send you photos. We have some of the best neighborhood restaurants and some actually deliver to our property. There are golf courses in the area and shopping is extremely convenient; two large grocery stores nearby. It's so quiet on the property you wouldn't know all of these conveniences are mostly within five to eight miles away and property is just 25 minutes from downtown.","Internet, Air Conditioning, Fireplace, TV, Satellite or Cable, Washer & Dryer, Children Welcome, Parking, No Smoking, Heater"
100,https://www.homeaway.com/vacation-rental/p3177240#reviews,"SXSW, ACL, Formula 1, UT Football (2-Miles to Downtown)",$830,5500 sq. ft.,"City of Austin historic landmark house is a great location for Texas Football, SXSW, F1 or ACL accommodations. This home is situated on a beautiful street in a highly desirable in-town neighborhood. The house is extremely centrally located and accessible to all Austin activities. The home was completely remodeled in 2009 and appointed with designer-quality, high end finishes that offer every modern convenience possible. The kitchen is chef ready and boasts, 2 dishwashers, Bosch Professional 4-burner stove with integrated grill, speed oven, counter seating for five, open concept to two dining rooms and two living rooms. The formal and informal dining rooms are open directly to the kitchen. There are 3 beautiful indoor seating areas to accommodate guests comfortably. With essentially 3-master bedrooms you can't go wrong with this property for your corporate retreat or couples looking to enjoy Austin.","Internet, Air Conditioning, Pets Welcome, Fireplace, TV, Satellite or Cable, Washer & Dryer, Children Welcome, Parking, No Smoking, Heater"
101,https://www.homeaway.com/vacation-rental/p3491296#reviews,"Modern 3-story Gem 7-bedroom with Pool & Hot Tub, 5 minutes from downtown",$826,4000 sq. ft.,"If you are looking to stay in one of the most gorgeous homes in Central Austin, this is your best bet. This is a 4,000 square foot home with 3 stories and cool outdoor patios. It is stocked full of all of the luxury-style amenities you can dream of. The kitchen is decked out with top of the line appliances, the rooms boast tons of natural light and super comfy beds, and the house is beautiful and spacious. The basement apartment is a refuge from the main house and can be a nice space for some privacy. The backyard has a beautiful pool with an infinity hot tub attached to the pool so you can cool off and then get hot, cool off, get hot, repeat, etc. This amazing home is tucked away on a quiet street and has a sweet swanky modern look.","Satellite or Cable, No Smoking, Washer & Dryer, Air Conditioning, TV, Children Welcome, Internet, Hot Tub, Parking, Heater, Swimming pool"
102,https://www.homeaway.com/vacation-rental/p3764524#reviews,"❤️ of SoCo Private Suite : Uncommon Luxury, Unbeatable Location, Unusual Value",$125,500 sq. ft.,"If Austin is the epicenter of where it’s at in USA, then SoCo (South Congress) is the epicenter of where it’s at in Austin. Just one block and mere steps from this mecca of eclectic shops, top-notch restaurants, and the quintessential Austin experience is your luxurious and quiet oasis. Your private entry to your suite is via a spacious deck shared with the onsite proprietors where you are welcome to read and relax under a lush canopy of ancient pecans. Once inside, you’ll be welcomed with amenities including chilled Topo Chico, Shiner bock, wine and filtered water, coffee/tea bar, and thoughtful treats. Your suite envelops you in serene luxury only steps from the lively bustle of South Congress. Your hideaway features an adjustable Tempurpedic mattress, luxury linens, two robes, a microwave, coffee maker and mini-refrigerator, free Google fiber wi-fi and flatscreen television. Walls of windows outfitted with built-in plantation shutters illuminate sumptuous design features including a sparkling Austrian crystal chandelier, exquisite Italian and Dutch antiques and art, and gorgeous mid-century modern furniture that grace the spacious suite. The stunning and singular bathroom is a dramatic sanctuary of Mexican and Italian tile and is ADA accessible with its walk-in shower equipped with hand held spray showerhead and built-in bench, grab rails, and elevated toilet. Ideal for an Austin holiday, business, or a festival-goers’ home base.","Internet, Air Conditioning, TV, Satellite or Cable, Parking, No Smoking, Heater"
103,https://www.homeaway.com/vacation-rental/p1142053vb#reviews,1BR w/ Loft in the Heart of Downtown Austin!,$137,566 sq. ft.,"Take in the sights and sounds of Austin from the comfort of this 1BR condo with loft area in the heart of downtown. Relax in the bright living area with chic furnishings and wood floors. Prepare meals in the well-equipped kitchen and enjoy them at the dining table, or step outside to dine at the bistro table.","Washer & Dryer, Children Welcome, Parking, Satellite or Cable, No Smoking, Air Conditioning, Heater, TV, Internet"
104,https://www.homeaway.com/vacation-rental/p119233#reviews,"Waterfront w/Kayaks, Decks, Waterslide, Boatlift, Relaxing, Fun!",$230,1500 sq. ft.,"Beautiful, waterfront home on Lake Austin - just 10 miles to zilker park. Kayak, boat, fish or just relax on one of the multiple decks. Cool waterslide, multiple rafts & floats plus lakeside Chiminea fireplace.","Internet, Air Conditioning, Fireplace, TV, Satellite or Cable, Washer & Dryer, Children Welcome, Parking, No Smoking, Heater"
105,https://www.homeaway.com/vacation-rental/p3480367#reviews,Travis Heights Studio Apt -- Walk To South Congress and Downtown,$74,450 sq. ft.,"Located behind an historic home on a private alley. Super charming, clean, located in quiet, lovely neighborhood. Two queen beds, WiFi-Google Fiber, and UVerse cable HDTV with premium channels, shower, refrigerator, microwave, toaster oven, coffee maker.","Internet, Air Conditioning, Pets Welcome, TV, Satellite or Cable, Parking, No Smoking, Heater"
106,https://www.homeaway.com/vacation-rental/p1099816vb#reviews,"New Home Close to Downtown, UT, restaurants & shops on Burnet",$185,1100 sq. ft.,Prepare to be wowed! New 2-story modern home built in 2017 in the wonderful Rosedale neighborhood.,"Internet, Air Conditioning, TV, Satellite or Cable, Children Welcome, Parking, No Smoking, Heater"
107,https://www.homeaway.com/vacation-rental/p122286#reviews,Newly Remodeled Lake Austin Waterfront Vacation Home,$550,,"You can experience plenty of rest and relaxation in this spacious waterfront home. Every room in the house has spectacular views of Lake Austin’s serene water. Whether you decide to boat or ski from our private boat area on the calm, glass-like water, lounge on the back deck or partake in Austin’s night life, this 3-bedroom home will suit your needs. The house is located just 15 minutes from shopping and 25 minutes from downtown Austin.","Internet, Air Conditioning, Fireplace, TV, Satellite or Cable, Washer & Dryer, Children Welcome, Parking, No Smoking, Heater"
108,https://www.homeaway.com/vacation-rental/p1329660vb#reviews,Charming & Updated Clarksville 3BR w/ Office – Walk to Dining & Shopping,$205,1604 sq. ft.,"With a charming exterior and an adorable interior to match, this 3BR/2BA home welcomes you to the vibrant and friendly city of Austin. Hardwood floors flow throughout this lovely home, which has queen beds in all three bedrooms.","Internet, Air Conditioning, TV, Satellite or Cable, Washer & Dryer, Children Welcome, Parking, No Smoking, Heater"
109,https://www.homeaway.com/vacation-rental/p3486281#reviews,Downtown Central East Austin Entire House 6th st. Rainey,$675,2800 sq. ft.,STR operating license # OL 2013 035236,"No Smoking, Air Conditioning, Satellite or Cable, Washer & Dryer, TV, Children Welcome, Internet, Heater, Parking"
110,https://www.homeaway.com/vacation-rental/p3488530#reviews,Tasteful Studio with perfect location just north of UT and Downtown.,$71,,"This charming studio is located in the heart of idyllic Hyde Park, one of Austin's most desirable neighborhoods, and offers a full kitchen and an elegantly tiled bathroom.","Air Conditioning, No Smoking, TV, Children Welcome, Internet, Heater, Parking"
