,property_url,headline,price,area,description,amenities
34,https://www.homeaway.com/vacation-rental/p3656342#reviews,BEAUTIFUL AND PEACEFUL DOWNTOWN RETREAT IN TRENDY OLD AUSTIN NEIGHBORHOOD,$499,3000 sq. ft.,"Enjoy an old Austin feel in downtown Austin's backyard. Immaculate home near just about everything Austin has to offer - SXSW, ACL, Formula 1 and COTA shuttle, Austin Film Festival, downtown district, Hike and Bike trail around Lady Bird Lake, Barton Springs, cool coffee houses, the flagship Whole Foods, eclectic shops, and some of Austin's finest restaurants (Clark's Oyster Bar, Jeffrey's, Winflo Osteria, Nightcap and Caffe Medici, just for starters). In the middle of it all, yet on a quiet street in the charming, hip and historic old Austin neighborhood of Clarksville.","Satellite or Cable, Washer & Dryer, No Smoking, Air Conditioning, TV, Internet, Children Welcome, Heater, Parking, Fireplace"
35,https://www.homeaway.com/vacation-rental/p205982#reviews,* Austintacious * Downtown * 2 - 4+ Bdrms * Walkable * Safe Neighborhood *,$160,2200 sq. ft.,Longer stays and smaller groups receive the best rates.,"Satellite or Cable, Washer & Dryer, No Smoking, Air Conditioning, TV, Internet, Children Welcome, Pets Welcome, Heater, Parking, Fireplace"
36,https://www.homeaway.com/vacation-rental/p3591447#reviews,"Quiet, Cozy Charmer, Downtown, But Rare Private Sanctuary",$81,300 sq. ft.,"Come, stay in our newly renovated studio apartment, formally a soundproof music studio. Quiet, private-perfect for one person or a couple. Very safe neighborhood.","Satellite or Cable, Washer & Dryer, No Smoking, Air Conditioning, TV, Internet, Children Welcome, Heater, Parking"
37,https://www.homeaway.com/vacation-rental/p212502vb#reviews,East Austin's Best Rental! 3 blocks to 6th & Franklin's! Large Groups Welcome!,$800,2700 sq. ft.,This Gorgeous 2500 square foot home is located 1 block East of IH-35! Arrive at the house within 10 minutes of leaving the airport and start your vacation right away!,"Internet, Air Conditioning, TV, Satellite or Cable, Washer & Dryer, Children Welcome, Parking, No Smoking, Heater"
38,https://www.homeaway.com/vacation-rental/p268686vb#reviews,Summer special. Great for large groups. Fantastic location.,$714,4500 sq. ft.,Fully licensed by the City of Austin. License #: OL 2012 110614,"Internet, Air Conditioning, Pets Welcome, Fireplace, TV, Satellite or Cable, Washer & Dryer, Children Welcome, Parking, No Smoking, Accessible, Heater"
39,https://www.homeaway.com/vacation-rental/p3528060#reviews,"Best Downtown Austin Location - Walk to Restaurants, Live Music, Conventions",$83,500 sq. ft.,"Location, location, location!!! You can't beat this downtown Austin location for work or play. Walk out your door and you will be in the heart of downtown Austin, next door to the Convention Center and just half a block away from hopping on the Cap Metro Light rail...not to mention grabbing a Starbucks coffee across the street. Walk just two blocks and you will be on 6th Street or in the Warehouse District of 4th Street, the two biggest nightlife areas of Austin with tons of bars, pubs and live music venues, as well as Congress Avenue and tons of downtown restaurants such as Eddie V's Prime Seafood, Vince Young Steakhouse, Piranha Sushi, Fogo de Chao and Moonshine Bar & Grill. Within four blocks is the famous Town Lake and its wonderful 10+ mile hike & bike trail. And a very short bus ride to the famous SoCo neighborhood. No car needed for this great location but parking is available if you need it. This downtown vacation rental lets you take care of business and fun at the same time and from the same place.","Washer & Dryer, Parking, Satellite or Cable, No Smoking, Accessible, Air Conditioning, Heater, TV, Internet"
40,https://www.homeaway.com/vacation-rental/p253029vb#reviews,"Relaxing Waterfront Home on Lake Austin, W/ Private Boat Dock",$265,1800 sq. ft.,"You'll enjoy our lovely and comfortable house right on Lake Austin as the perfect venue for fun with family & friends. It is a great place for just relaxing on the deck or taking your boat out for a day of skiing on the lake. Or you can do some fishing off our dock, visit nearby shopping areas, restaurants and golf courses.","Internet, Air Conditioning, Fireplace, TV, Satellite or Cable, Washer & Dryer, Parking, No Smoking, Heater"
41,https://www.homeaway.com/vacation-rental/p290688#reviews,"Colorful and FUN 2/1 duplex - two blocks to Zilker Park. King & 2 twins, sleep 6",$156,1008 sq. ft.,"The two bedroom “Kaleido House” features original art and colorful decor to go along with the spacious vaulted natural wood ceilings. The master bedroom features a comfy King bed and the 2nd bedroom has 2 X-long twins that can be made up into a king upon request. The couch in the living room is a Queen sleeper. Highlighting the cedar lined bathroom is a 200 gallon double shower/hot tub with skylight*. Located just two blocks from Zilker Park and Barton Springs Pool, the Kaleido House is the perfect home base to enjoy everything that Austin has to offer. There is easy walking access to many of Austin’s famous restaurants as well as the outdoor paradise that is Zilker Park. Take a dip in the 68 degree waters of Barton Springs after enjoying a hike through the Barton Creek Greenbelt or a stroll around Lady Bird Lake. After a day outdoors, you’re only a short walk back!","Satellite or Cable, No Smoking, Pets Welcome, Washer & Dryer, Air Conditioning, TV, Children Welcome, Internet, Hot Tub, Parking, Heater"
42,https://www.homeaway.com/vacation-rental/p3165621#reviews,"5 bedrooms, 3 living areas between 2 houses, Rent both to sleep 16",$850,3600 sq. ft.,***Completion in October 2018***,"Swimming pool, Internet, Air Conditioning, Pets Welcome, Fireplace, TV, Satellite or Cable, Washer & Dryer, Children Welcome, Parking, No Smoking, Accessible, Heater"
43,https://www.homeaway.com/vacation-rental/p247938#reviews,"Walk anywhere from Cozy, Modern Treehouse overlooking 1/2 acre near Zilker",$60,730 sq. ft.,"Newer two story, modern guest cottage attached to historic 'Cistern House' on ½ acre close to Zilker Neighborhood. The 'Cistern House Annex' is within walking distance to the back gate of Barton Springs Pool, Lady Bird Lake hike and bike trail, Umlauf Sculpture Garden, Long Center, and movie theatre, restaurants and coffee shops. Hardwoods upstairs, stained concrete down, open kitchen with custom cabinets, stainless appliances, natural light in every room – even the walk in closet. Upstairs bedroom has feel of treehouse with wall of casement windows and custom blinds, overlooking 100 year old Oaks. Duplex is attached to main house by a solid stone wall, creating both a sound barrier and one of a kind wall of natural cut stone in the living area. The owners occupy the adjoining historic 'cistern' house and studio. Partially enclosed private patio. Google Fiber Internet, Flat screen TV upstairs and down. License #098980","Satellite or Cable, No Smoking, Washer & Dryer, Air Conditioning, TV, Children Welcome, Internet, Parking, Heater"
44,https://www.homeaway.com/vacation-rental/p3479083#reviews,4 Bedroom Modern - Complete Remodel,$199,1700 sq. ft.,Please inquire before booking.,"Internet, Air Conditioning, Pets Welcome, TV, Satellite or Cable, Washer & Dryer, Children Welcome, Parking, No Smoking, Heater"
45,https://www.homeaway.com/vacation-rental/p3602858#reviews,"Funky clean, fresh and energetic South Austin home.",$162,800 sq. ft.,"South Austin home with original hardwood floors. Comfortable living room with sofa, chairs, free WiFi and local TV. Sit, relax and unwind from your day. The kitchen is fully furnished with all the conveniences of a stove, refrigerator, microwave, coffee maker, toaster, dishes/utensils and some pantry items. There is also a washer and dryer for your convenience. The hardwood floors throughout lead you to the two bedrooms. Both bedrooms have queen size beds. Should you need extra sleeping arrangements, there is a queen size blow up mattress for your use. The remodeled bathroom includes a shower, bath tub and towels. There is a tiered deck out back for early morning coffee and breakfast or your evening meal. The front and back of the house is landscaped with Texas tolerant, native plants for you to enjoy. So, relax and enjoy your stay ... Austin-Style.","Internet, Air Conditioning, Pets Welcome, TV, Washer & Dryer, Parking, No Smoking, Heater"
46,https://www.homeaway.com/vacation-rental/p329230#reviews,"Amazing Patio with View, Top Floor, King bed, 2 blks to Zilker, 2 mi to Downtown",$132,589 sq. ft.,"The fun loving Heart House will certainly make you smile! You will sleep soundly in the king pillow-top mattress and enjoy the 3rd story view from the floor to ceiling windows in the bedroom and from the patio off the dining area through the sliding glass door. The living room features a vaulted ceiling with clerestory windows which provide wonderful natural lighting. The patio is always a popular hangout spot for your morning coffee, dinner, or a late night cocktail. The Heart House has a fully furnished kitchen to cook in if you so choose. There are 2 gas grills shared by 3 properties in front of the building. The entry is only a 8 steps from the parking spot right in front of this 6 unit building built into a hill in Barton Hills. Have fun finding the hearts in all the art on the walls!","Satellite or Cable, No Smoking, Pets Welcome, Washer & Dryer, Air Conditioning, TV, Children Welcome, Internet, Parking, Heater, Fireplace"
47,https://www.homeaway.com/vacation-rental/p375283#reviews,4B - 4 Bedroom Contemporary w/2 Living Rooms,$219,2300 sq. ft.,Please inquire before booking.,"Internet, Air Conditioning, Pets Welcome, TV, Satellite or Cable, Washer & Dryer, Children Welcome, Parking, No Smoking, Heater"
48,https://www.homeaway.com/vacation-rental/p154740vb#reviews,"Walk to Downtown, SouthxSW, ACL,SoCo, 6th Street, yet quiet, semi-forest setting",$284,1757 sq. ft.,"Avoid cabs and finding parking for festivals and Downtown. A short pleasant walk to most events. A great 1750 square foot, three bedroom, two bath, two story home with an incredible location one block from South 1st and six blocks from South Congress Ave.(SoCo).","No Smoking, Air Conditioning, Washer & Dryer, Satellite or Cable, TV, Children Welcome, Internet, Heater, Parking"
49,https://www.homeaway.com/vacation-rental/p330221#reviews,"Cute/private 1-bed 2 blocks to Zilker Park & Barton Springs, 2 miles to Downtown",$115,576 sq. ft.,"Located on the edge of Barton Hills, just 2 blocks from Zilker Park and Barton Springs Pool, The Sweet is a perfect spot for a couple, or small family, coming to enjoy what Austin does best: get outdoors!","Satellite or Cable, No Smoking, Pets Welcome, Washer & Dryer, Air Conditioning, TV, Children Welcome, Internet, Parking, Heater"
50,https://www.homeaway.com/vacation-rental/p3465404#reviews,NO home is more in the HEART of SOCO than this one!,$550,1500 sq. ft.,56 glowing Reviews giving the home the highest rating possible at 5 out of 5 stars!,"Internet, Air Conditioning, TV, Satellite or Cable, Washer & Dryer, Children Welcome, Parking, No Smoking, Heater"
51,https://www.homeaway.com/vacation-rental/p3525765#reviews,3 Bedroom Cottage - Near Downtown & UT,$192,1500 sq. ft.,Please inquire before booking.,"Internet, Air Conditioning, TV, Satellite or Cable, Washer & Dryer, Children Welcome, Parking, No Smoking, Heater"
52,https://www.homeaway.com/vacation-rental/p3717270#reviews,Hot 51st St Walk To Mueller 2 Bdr Modern Luxury Sleeps 7 (OL2014008430),$113,1000 sq. ft.,"This Modern Luxury property is centrally located, just north of downtown & UT campus and right next door to the new Dell Children's Hospital and walking distance to Mueller area and all the amenities. Three parks (with playgrounds, park with Frisbee golf and a new pool and new water park (Opening in May 2014) within walking distance. Bus stop walking distance from rental - on the bus route to UT. Distance to local attractions: 1 block from Bartholomew Pool and water park, 2.7 miles to University of Texas, 3.6 miles to 6th Street (downtown music district), 3.9 miles to Austin Convention Center, 5.9 miles to Zilker park (location of ACL). The house has fully equipped modern entertaining kitchen, sleeps and eats for 7, high speed wireless and HD basic TV with Amazon, Epix, Showtime and other apps on the roku device (can log into other apps like netflix or other if you have accts), back yard fun, fenced in yard, and Austin Kewl. It is ideal for corporate rentals, visiting family/friends, UT fans (great access to the stadium), music festivals (SXSW & ACL), X Games, Formula One, Dell Children Hospital or just getting to know Austin.","Internet, Air Conditioning, Pets Welcome, TV, Satellite or Cable, Washer & Dryer, Children Welcome, Parking, Accessible, Heater"
53,https://www.homeaway.com/vacation-rental/p3525767#reviews,4 Bedroom Lakeview - With Hot Tub,$226,2000 sq. ft.,Please inquire before booking.,"Swimming pool, Internet, Air Conditioning, Hot Tub, Pets Welcome, TV, Satellite or Cable, Washer & Dryer, Children Welcome, Parking, No Smoking, Heater"
54,https://www.homeaway.com/vacation-rental/p3557534#reviews,* Zilker Park * Barton Springs * Luxury Treehouse * Piano *ACL*,$595,1800 sq. ft.,"Staying here in this 3-story townhome, you will enjoy living downtown while being surrounded by a peaceful green space on a quiet, dead end street. One guest commented that it feels like 'I'm living in a beautiful luxury tree house with a grand piano.' You will not have to worry with all of the Austin Gridlock traffic because you are close to almost EVERYTHING!! Close enough to the action, but far enough away to get some sleep! Zilker Park, Barton Springs, ACL, SXSW, Long Center, Town Lake Hike and Bike Trail, Zilker Botanical Gardens, Palmer Events Center, Zach Scott Theater, go canoeing, or eat at plenty of the great restaurants, (like the original Chuy's) and there's also a grocery nearby. You will be living closer to Zilker Park and Barton Springs than the car parking areas for ACL! City bus is a only a 10 minute walk. You'll have nice views and beautiful sunsets. The open kitchen and living area are on the second floor. This contemporary home has been recently remodeled with all furnishings including granite countertops, coffee machine, large outdoor grill, and all new appliances! 3 Bedrooms, one on each floor, 3 Full Bathrooms, Garden shower, grand piano, glass atrium and a fireplace. Fun, Funky neighborhood on a quiet 'No Outlet' street. Covered parking available. Wifi. Great place for kids that are old enough and young enough, to negotiate stairs. We are happy to offer some directions or assistance; whatever will make your stay more comfortable. We can usually offer discounts for extended stays and repeat customers--just ask. We are licensed by the City of Austin (We apologize in advance for the ridiculous Austin taxes). We are always happy to help you navigate all the Austin awesomeness! Can't wait to help make your stay in Austin absolutely terrific!","No Smoking, Pets Welcome, Washer & Dryer, Air Conditioning, TV, Children Welcome, Internet, Parking, Heater, Fireplace"
55,https://www.homeaway.com/vacation-rental/p342346#reviews,The Palms - Waterfront with Dock/Near Oasis/Close to town/Pool Table/Hot Tub,$753,3000 sq. ft.,STAY ON THE LAKE! CLOSEST TO TOWN! MAIN BASIN - NEAR DAM!,"Fireplace, Children Welcome, Hot Tub, Washer & Dryer, Satellite or Cable, No Smoking, Parking, TV, Internet, Heater, Air Conditioning"
56,https://www.homeaway.com/vacation-rental/p223235vb#reviews,"Downtown Austin 3BR - $195/nt - Walk to Bars, Music, Town Lake",$246,1090 sq. ft.,Downtown Austin 3BR/2bath Condo!,"Washer & Dryer, Parking, Satellite or Cable, No Smoking, Air Conditioning, Heater, TV, Internet"
57,https://www.homeaway.com/vacation-rental/p3466249#reviews,"Perfect home for SXSW, walk to downtown, SoCo, Rainey st",$400,2000 sq. ft.,"This 1914 Craftsman Bungalow is a rare gem, one of a few houses in Austin located on the south side of Lady Bird Lake overlooking downtown. The location is ideal - 10 minutes west of the airport, 5 minutes south of downtown and just east of South Congress, with easy access to the 10 mile hike-and-bike trail that circles Lady Bird Lake and to IH35, which links Austin to San Antonio and the Dallas/Fort Worth Metroplex. For those wishing to visit SXSW, the Formula One race track, ACL, or other centrally located festivals, our home is perfect.","Internet, Air Conditioning, TV, Satellite or Cable, Washer & Dryer, Children Welcome, Parking, No Smoking, Heater"
58,https://www.homeaway.com/vacation-rental/p3624176#reviews,4 Bedroom North Austin,$149,2000 sq. ft.,Please inquire before booking.,"Internet, Air Conditioning, Pets Welcome, Fireplace, TV, Satellite or Cable, Washer & Dryer, Children Welcome, Parking, No Smoking, Heater"
59,https://www.homeaway.com/vacation-rental/p371165vb#reviews,"Best Location in Austin! Large Home, Sleeps 10, 4 Bed/5Bath, Huge Balcony!",$850,2500 sq. ft.,"3 big houses all downtown, all on the same street. If you have a small group rent one house, if you have up to 20 guests rent two house if you have a big group of up to 30 rent all 3 houses!","Internet, Air Conditioning, TV, Satellite or Cable, Washer & Dryer, Parking, Accessible, Heater"
60,https://www.homeaway.com/vacation-rental/p167137vb#reviews,Downtown Austin 2BR - Walking Area $190/nt- Better Than Hotel,$212,850 sq. ft.,"Please note that nightly rates will vary for Special Weekends such as UT Graduation, ROT Rally, 4th of July, UT Home Football Games, SXSW and ACL.","Washer & Dryer, Parking, Satellite or Cable, No Smoking, Air Conditioning, Heater, TV, Internet"
61,https://www.homeaway.com/vacation-rental/p224665vb#reviews,"Central Austin Historical Landmark Home,One Half Acre Grounds!",$196,2400 sq. ft.,"Relax or enjoy Austin's sights from this unique setting: a beautifully restored Craftsman- style house built in 1911 and registered as an Austin Historical Landmark. It sits on a beautifully landscaped one-half acre lot in the quiet Hyde Park area of the city just north of the University of Texas campus. Completely renovated, yet conserving the graceful ambience of the original home, Harris Park Guest House is furnished with an eclectic mix of antiques and mid-twentieth century modern furniture. The fully equipped kitchen and formal dining room are ideal for cooking, dining, even entertaining.","Internet, Air Conditioning, TV, Satellite or Cable, Washer & Dryer, Children Welcome, Parking, No Smoking, Heater"
62,https://www.homeaway.com/vacation-rental/p3652120#reviews,A Luxurious Austin Treasure In The Heart Of Clarksville.,$275,950 sq. ft.,"This adorable and historic one bedroom house has been totally restored and remodeled within the last six months into a luxurious bungalow competing with the top five star resorts in the city. Top of the line HDTV's, luxury linens, dishes,modern gas kitchen, coffee area, surround sound with indoor/ outdoor speakers, one and a half baths, separate study area, large covered porch and two balconies are just a few of this home's amenities. Clarksville is known for its charm and has many shops, restaurants and coffee bars within walking distance. You will love staying at this home. Walk to ACL via the footbridge. Walk to the trail at Lady Bird Lake. Great spot.","Satellite or Cable, Washer & Dryer, No Smoking, Air Conditioning, TV, Internet, Children Welcome, Pets Welcome, Heater, Parking"
63,https://www.homeaway.com/vacation-rental/p3511441#reviews,Modern 3BR Condo -Epicenter of Downtown Austin. Next to Austin Convention Center,$503,1300 sq. ft.,"When visiting the live music capitol of the world with family or friends, there is no substitute for the spacious, modern and freshly renovated condo than we offer at The Loft at Railyard Downtown.","Fireplace, Washer & Dryer, Parking, Satellite or Cable, No Smoking, Air Conditioning, Heater, TV, Internet"
64,https://www.homeaway.com/vacation-rental/p3732291#reviews,Private And Spacious South Austin Retreat - A Bit Of Country In The City!,$600,2300 sq. ft.,"Tranquil with a modern country vibe, this house exemplifies South Austin. The main house consists of 4 bedrooms and 2.5 bath with a pull out couch in the living room, comfortably housing 8-10 people. There is a large studio with a queen bed and full bath out back - great for a couple or new family. **This is included in the rental, as the property rents as a whole.**","Air Conditioning, Heater, TV, Satellite or Cable, Washer & Dryer, Children Welcome, Pets Welcome, Internet, Parking, Fireplace"
65,https://www.homeaway.com/vacation-rental/p297616#reviews,"Walk to ACL, 1st Weekend ACL Just Opened-up Again!!",$125,800 sq. ft.,"Currently, Deep Eddy is not available for rentals over 1 week. The Deep Eddy Cottage is a 1946 bungalow that has been in my family since it was built. It's a rare one bedroom house with beautiful hardwood floors, fully equipped kitchen with new 5 burner stove, new Bosch dishwasher, refrigerator, microwave, and washer and dryer. It's a great place to get work done too with Grande fiber 1 gig internet. The bedroom has a king sized bed, the dining area has been turned into a sleeping alcove with a queen size innerspring futon. In addition, there is a twin daybed in the ample living room.","Internet, Air Conditioning, Pets Welcome, TV, Satellite or Cable, Washer & Dryer, Children Welcome, Parking, No Smoking, Heater"
66,https://www.homeaway.com/vacation-rental/p3732412#reviews,East 2nd Guest House - 1br/1ba - Luxury and Fab Location with City View,$119,525 sq. ft.,"1br/1ba rental in the heart of it all, surrounded by great bars, restaurants and venues. East 2nd Guest House offers you a hub that's less than a half mile to the Austin Convention Center and Hilton, and less than a mile to JW Marriott. Its the perfect spot for business or pleasure, and comfortably sleeps 2 in a queen bed.","No Smoking, Air Conditioning, Satellite or Cable, Washer & Dryer, TV, Children Welcome, Internet, Heater, Parking"
67,https://www.homeaway.com/vacation-rental/p244624#reviews,"Modern, Cozy, Guesthouse, Near Downtown, UT, & All Venues + Bikes+Solar Panels",$108,549 sq. ft.,"Business? Vacation? Enjoy 'green' urban living in this garage apartment, with a guest house feel, situated in Central Austin's charming new Mueller Neighborhood.","Internet, Air Conditioning, Pets Welcome, TV, Parking, No Smoking, Heater"
68,https://www.homeaway.com/vacation-rental/p3023784#reviews,Modern Cube House in 78704 SOCO/Bouldin,$120,850 sq. ft.,"Small but comfy 2-story, 2-Bedroom Euro-style house. Very clean with plenty of natural light. ALL NEW beds with NEW Serta mattresses. We also have a New couch/lounger. Amenities include FULL kitchen w/all modern appliances, with LED TV and HE Washer/Dryer. Concrete floor on downstairs/living/kitchen area; Bamboo hardwoods in bedrooms/upstairs. Private parking right in front of house, with enclosed fence. Property owner/manager is on site for any help, guidance or local suggestions.","No Smoking, Air Conditioning, Washer & Dryer, TV, Children Welcome, Pets Welcome, Internet, Heater, Parking"
69,https://www.homeaway.com/vacation-rental/p354187#reviews,Covered Patio with Views from quiet condo 2 blks to Park. King bed plus sofa bed,$145,589 sq. ft.,Welcome to The ATX House!,"Satellite or Cable, No Smoking, Pets Welcome, Washer & Dryer, Air Conditioning, TV, Children Welcome, Internet, Parking, Heater, Fireplace"
70,https://www.homeaway.com/vacation-rental/p3607273#reviews,Urban Homestead - 3BR/2.5BA Chic Farmhouse - Wonderfully Styled,$202,1250 sq. ft.,"3br/2.5ba rental offering the best of South Austin, in style and location. This house boasts historic Texas architecture and chic fine-furnishings, sleeping six comfortably in beds.","Internet, Air Conditioning, Pets Welcome, TV, Satellite or Cable, Washer & Dryer, Children Welcome, Parking, No Smoking, Heater"
71,https://www.homeaway.com/vacation-rental/p3517886#reviews,Central Downtown Entertainment - Gorgeous Relaxing BACKYARD Park Setting Trees,$292,1700 sq. ft.,You're gonna love it!!!,"Internet, Air Conditioning, Fireplace, TV, Satellite or Cable, Washer & Dryer, Children Welcome, Parking, No Smoking, Heater"
72,https://www.homeaway.com/vacation-rental/p3726987#reviews,"Serene Waterfront Lake Austin House, Stunning Views & Spectacular Boat Dock",$488,2500 sq. ft.,"Enjoy magnificent views at the top of this gated 5.5 acre secluded, private lake front estate property. The 1950's lake house, perched at the top of a rocky bluff, was designed with huge windows to take advantage of the stunning views of Lake Austin.","Swimming pool, Internet, Air Conditioning, Pets Welcome, Fireplace, TV, Satellite or Cable, Washer & Dryer, Children Welcome, Parking, No Smoking, Heater"
73,https://www.homeaway.com/vacation-rental/p3630010#reviews,Centrally located guesthouse is an urban oasis,$195,500 sq. ft.,"Built in the 20's, Leon House is the guesthouse of my historic Austin property, but separated from my house by a fence and good sized yard and accessed from a separate alley, ensuring a private and comfortable stay. This 500 square foot cottage features a living/dining area with HDTV and WiFi, a cozy queen bedroom with yummy linens, season-appropriate bedding and a closet, a small but highly functional shower bathroom and a full kitchen, outfitted by me (I love to cook) that has a dishwasher and washer/dryer. I lived here for six weeks while my home was being renovated and was seriously questioning the need to move across the yard.","Internet, Air Conditioning, TV, Satellite or Cable, Washer & Dryer, Parking, No Smoking, Heater"
