,property_url,headline,price,area,description,amenities
0,https://www.homeaway.com/vacation-rental/p3579610#reviews,"Cliffside OVER ""THE"" park-REALLY?!!!! YESSSS!!! - ADVENTURE across the street.",$575,1800 sq. ft.,"ACL 2nd weekend NOW AVAILABLE. 1 block to front gate!!!! Costa Rican inspired luxury- Panoramic Zilker Park VIEWS. Excellence in Austin. Penthouse atmosphere perched cliff-side in the trees overlooking Austin's own Central Park. Enjoy being so close to downtown AND have Barton Springs Pool /Park and the River as good as in your front yard. UNSURPASSED LOCATION. **Rates are based on a PER PERSON basis. Please be sure to enter the correct number of guests for an accurate quote and invoice. Zilker Park is 365 amazing acres, ABSOLUTELY across the street. This property has been a bridal party destination for multiple guests. ************** Please inquire for Holiday/special event rates (March 8-20) and minimums ********* The first thing you will see as you walk into your living space is 3 sets of french doors opening to incredible views of Zilker Park. Wrap around HUGE DECK and an enormous picture window enhance your experience of the beautiful Park. The back entrance to Barton Springs Pool is literally just 379 steps away. You can see it from the balcony. We have UNRIVALED IMMEDIATE ACCESS to Lady Bird Lake and 10 miles of hike and bike trail surrounding the lake. This is Austin’s social hub for hiking, biking, canoeing, kayaking and paddle boarding. You are walking distance to so many of Austin's finest iconic restaurants, bars and Alamo Drafthouse theater. Unlauff Sculpture Garden is half a block away. This property captures the true essence of the park by bringing the outdoors into your living space. In the morning or evening, with the 3 french doors open, the breeze is spectacular. The space offers a tranquil setting embodied by all natural materials including cedar ceilings, wood and limestone counters, and a solid granite kitchen sink. 2nd living room is luxurious and peaceful with a 70"" TV if a game or movie is in order. It doubles as a bunk room for large parties. Bathrooms boast pristine white stucco with sparkling Quartz rock flooring. This property is the complete upper level of a luxury duplex with street level entrance. and built in the 1960s by a local famous architect AD Stenger. Designed to be a perfect romantic getaway for two or a vibrant family gathering.","Internet, Air Conditioning, Pets Welcome, TV, Satellite or Cable, Washer & Dryer, Children Welcome, Parking, No Smoking, Heater"
1,https://www.homeaway.com/vacation-rental/p3530299#reviews,Hyde Park Historic District - Close To Everything Austin Has To Offer!,$109,550 sq. ft.,"Built in 2010, the garage apartment was constructed with the same quality and style as the 100 year old victorian main home.","Washer & Dryer, Air Conditioning, No Smoking, TV, Internet, Heater, Parking"
2,https://www.homeaway.com/vacation-rental/p3633840#reviews,"Perfect Getaway - Quiet, But Close To Everything",$75,196 sq. ft.,"Cozy 196 s.f. Tiny house with all the basic amenities. Kitchenette with fridge, microwave, toaster and coffee maker. Very comfortable queen-size fold down Murphy bed, sofa and great front porch. Bathroom with shower. Small fold-down leaf table with chairs.","No Smoking, Air Conditioning, Pets Welcome, Internet, Heater, Parking"
3,https://www.homeaway.com/vacation-rental/p321912vb#reviews,"Sweet & comfortable 2/1 Bouldin home.Walk to food trailers,Zilker/Barton Springs",$151,800 sq. ft.,Fully Licensed by the City of Austin. License number,"No Smoking, Air Conditioning, Washer & Dryer, Satellite or Cable, TV, Children Welcome, Pets Welcome, Internet, Heater, Parking"
4,https://www.homeaway.com/vacation-rental/p3636062#reviews,Suite in Historic Downtown Home - 4 Blocks from Capitol,$105,500 sq. ft.,"Eleven Oaks Suite is located in a downtown Austin home that has both city and state historical designation. Your hosts, who live on the premises, are homeowners Ted Siff and Janelle Buchanan and their two daughters. The original part of the house was built in 1858 by Edward Clark, who was Texas’ lieutenant governor under Sam Houston and, briefly, governor.","Internet, Air Conditioning, TV, Satellite or Cable, Parking, No Smoking, Heater"
5,https://www.homeaway.com/vacation-rental/p372384#reviews,Casita Lunita-Southwestern Eclectic Cottage in Heart of SoCo-Central Austin!,$195,1200 sq. ft.,Enjoy life in the heart of Austin's Travis Heights/South Congress area.,"Internet, Air Conditioning, Pets Welcome, Fireplace, TV, Satellite or Cable, Washer & Dryer, Children Welcome, Parking, No Smoking, Heater"
6,https://www.homeaway.com/vacation-rental/p3477728#reviews,"3BR/2BA Home Close to Zilker Park, ACL and downtown",$265,1800 sq. ft.,"This 3BR/2BA attractive and comfortable remodeled house is perfectly located to access many popular Austin activities. The house has an excellent floor plan, with the master bedroom and bath upstairs and an additional two bedrooms and full bath downstairs. Behind the house, guests will enjoy a limestone patio with a built-in fire ring, a BBQ pit, and a dining table situated under an elegant arbor. The well-maintained landscaping showcases a lighted washer pit and gated front and back yard.","No Smoking, Air Conditioning, Washer & Dryer, Satellite or Cable, TV, Internet"
7,https://www.homeaway.com/vacation-rental/p3489155#reviews,Downtown convenience in quiet neighborhood for restful stay!,$72,300 sq. ft.,"Our spacious, quiet, one bedroom studio is a comfortable home base for tourists and business travelers. We look forward to hosting you in our convenient Austin neighborhood three miles south of downtown. We are 1/2 mile from newly developed The Yard—a collection of breweries, coffee shops, wine tasting rooms, food trailers, and a whiskey still. Walk down and have everything you need in one spot! The Spokesman has excellent coffee and a light breakfast/lunch menu. St Elmo brewery has been rated one of the top new breweries in town, has a tasty food truck Sour Sop, and offers great music including a Thursday night bluegrass set.","Internet, Air Conditioning, TV, Satellite or Cable, Parking, No Smoking, Heater"
8,https://www.homeaway.com/vacation-rental/p169977#reviews,"Oasis near downtown Austin - 8 bedroom house on 30 acres with pool, party barn.","$1,248",4000 sq. ft.,The Rockin’ Y Ranch is a beautiful hilltop home just 15 minutes from Downtown Austin. Perfect for getting together with family and friends. Here are some details on this beautiful getaway:,"Swimming pool, Internet, Air Conditioning, Pets Welcome, Fireplace, TV, Satellite or Cable, Washer & Dryer, Children Welcome, Parking, No Smoking, Heater"
9,https://www.homeaway.com/vacation-rental/p3641254#reviews,ADVENTURE begins here -Open LOFT- ON Zilker PARK-300 steps to Barton POOL,$350,1440 sq. ft.,"Enjoy all the richness that is Austin’s own central park, 365 amazing acres, ABSOLUTELY across the street. **This property rates are based on a per person basis. Please enter correct number of guests for an accurate quote and invoice. We have UNSURPASSED ACCESS to Lady Bird Lake and the 10 miles of hike and bike trail surrounding the lake. This is Austin’s social hub for hiking, biking, canoeing, kayaking and paddle boarding. You will be literally steps to Barton Springs Pool. * This property offers you inspired design focused on the style and relaxed appeal of Austin, with flavors of a cottage in the French countryside. Breezy sun drenched flex space opens up to the main living area with a sliding wall and 6' corrugated swinging door creating a huge entertainment social space. When closed it offers two XL twins with ensuite. The vibe is ""oversized loft"" ""and a part of the park"" with stone flooring and wood ceilings. Restoration Hardware crystal chandeliers fill the dining area and lounge spaces with sparkling light. Enjoy cooking in a fully stocked stone and wood kitchen with a luxurious marble farmers sink and custom gourmet prep island. The living/dining area is complete with 2 sets of French doors and 6 additional over-sized windows. Features include: An expansive deck off the living room, 2 impeccable stone and stucco full bathrooms with surround rainfall shower. Off the master a large fenced yard allows for any accompanying pet to roam freely. We are WALKING distance to so many of Austin’s finest dining experiences, pubs, night clubs and Alamo Drafthouse Cinema. Umlauff sculpture garden half a block away. This property is the complete private (no interior access) bottom level of a luxury duplex with convenient parking by the front door. It is a truly spectacular property in an unsurpassed location. This is an exquisitely restored/remodeled duplex, lower level. The upper duplex is a vacation rental property as well. Much like the most luxurious older hotels you can hear some noise transference. Pricing has definitely been adjusted for this potential. If you are sensitive to this, perhaps another property would better suit you. PLEASE INQUIRE FOR ACL AND SXSW (March 8-20) SPECIAL EVEN PERIOD RATES.","Internet, Air Conditioning, Pets Welcome, TV, Washer & Dryer, Children Welcome, Parking, No Smoking, Heater"
10,https://www.homeaway.com/vacation-rental/p360801#reviews,DOWNTOWN! FIRST ACL WEEKEND AVAILABLE //SLEEPS 16,"$1,160",4500 sq. ft.,"Built in 2012 The Betty Jo has 6 bedrooms, 7 baths, 4 living rooms 2 kitchens and a backyard deck equipped with 2 gas fire pits and plenty of seating! This property is equipped with high speed internet, cable and two 60-inch plasma flat screen TVs. Two full service kitchens make this home a prime spot for entertaining. 5 minutes from downtown Austin, The Betty Jo's location is ideal for any Austin event or festival.","Internet, Air Conditioning, TV, Satellite or Cable, Washer & Dryer, Parking, No Smoking, Heater"
11,https://www.homeaway.com/vacation-rental/p374108vb#reviews,Everyone Loves this Downtown Location! 2 bedroom plus loft,$179,1250 sq. ft.,Austin STR License: OL 2012 110070,"Internet, Air Conditioning, TV, Satellite or Cable, Washer & Dryer, Children Welcome, Parking, No Smoking, Heater"
12,https://www.homeaway.com/vacation-rental/p370228vb#reviews,"Best location in Austin! Super Close to UT, Capitol, & Downtown",$195,1250 sq. ft.,Austin STR License: OL 2012 103339,"Internet, Air Conditioning, TV, Satellite or Cable, Washer & Dryer, Children Welcome, Parking, No Smoking, Heater"
13,https://www.homeaway.com/vacation-rental/p3580000#reviews,"FAMILY FUN:Lakefront, Water Trampoline, Sand Vball, Kayaks, PaddleBoard",$230,900 sq. ft.,"Top rated Lake Austin spa is minutes away, rent paddle boards at the park down the road, or paddle our kayaks to the nature preserve across the lake and hike up to a waterfall. Our sand volleyball court is regulation size, we have a water trampoline, and diving board. But the serenity of this property may lead you to R&R and forgo all that activity - the screened in porch with antique iron day beds and desk beckons as a writer's retreat. Custom built with cedar flooring and rugged beams. Feels like middle of nowhere but great restaurants (sushi, Mexican, Steiner Ranch Steakhouse) are in the neighborhood, famous sunsets at the Oasis on Lake Travis 7 miles away, and 30 minutes from downtown Austin.","Internet, Air Conditioning, Hot Tub, Pets Welcome, Fireplace, TV, Satellite or Cable, Washer & Dryer, Children Welcome, Parking, No Smoking, Heater"
14,https://www.homeaway.com/vacation-rental/p3586016#reviews,Furnished One Bedroom In South Congress District (SoCo),$165,485 sq. ft.,"Bouldin Creek Treehouse is an entirely furnished apartment located in Austin’s famous South Congress District (SoCo), available for short-term rental.","No Smoking, Air Conditioning, Satellite or Cable, TV, Children Welcome, Internet, Heater, Parking"
15,https://www.homeaway.com/vacation-rental/p324951vb#reviews,Delightful Downtown West 6th Street Condo - Walk to Everything,$179,883 sq. ft.,"WINTER SPECIAL....book for 30 nights or more, and get 30 nights for $2,500, December, January and February only. No taxes, no fees. See what it's like to live downtown! ($2000 refundable deposit required, and must be booked through owner, not this site...just send an email if interested).","Satellite or Cable, Washer & Dryer, No Smoking, Air Conditioning, TV, Internet, Heater, Parking"
16,https://www.homeaway.com/vacation-rental/p272323#reviews,"View from patio - 2 bedroom, 2 blks to Zilker Park, 2 mi to Downtown - king bed!",$148,787 sq. ft.,"The Treehouse has 2 bedrooms, 1 bath plus an extra sink and vanity in the master. There is a king size bed in the master and a full size bed in the small 2nd bedroom.","Satellite or Cable, No Smoking, Pets Welcome, Washer & Dryer, Air Conditioning, TV, Children Welcome, Internet, Parking, Heater, Fireplace"
17,https://www.homeaway.com/vacation-rental/p3466675#reviews,"Zilker, Downtown Austin view, Avail for 2nd ACL weekend!",$150,800 sq. ft.,"Modern, nicely decorated casita, our guest house, 1 BR, 1.5 bath in the heart of the Zilker neighborhood, walking distance to restaurants and downtown. Highlight is a terrace with fabulous downtown view. It is very private, set in the back of our spacious property. A great place to vacation and enjoy Austin. Quiet neighborhood where everyone knows each other. Perfect place to make home base while exploring Austin. Close to Zilker Park where ACL is held, downtown and famous South Congress district are also nearby.","Internet, Air Conditioning, TV, Satellite or Cable, Washer & Dryer, Parking, No Smoking, Heater"
18,https://www.homeaway.com/vacation-rental/p243133#reviews,"Lake Austin Waterfront Retreat - Hot Tub, SUP, WiFi, Dogs Okay",$245,1100 sq. ft.,"Lake Austin waterfront is a great place to escape all year around. Lake Austin Retreat offers a beautiful Mexican style waterfront property with a boat dock, huge decks and a hot tub situated on a secluded bend of Lake Austin just 20 miles from downtown Austin. Relax, unwind, enjoy the Stand Up Paddle boards, swim, canoe, kayak, bird-watch, fish, or enjoy a spa-treatment at nearby Lake Austin Spa. The house accommodates 6 guests (if your group is larger than 6, please consider renting a neighbor's property which sleep's 6, in addition to ours - Homeaway Property # 7064882), and the spacious back yard offers an abundance of outdoor space for socializing, BBQ'n, playing or enjoying quiet hammock-time. Bring your boat and ski (boats can be moored at the dock but no boat lift is available), or lounge by the water's edge and drink in the view of the Golden Cheeked-Warbler habitat directly across the lake. You will love taking advantage of the most peaceful stretch of Lake Austin. Mornings are not to be missed. Grab your coffee or tea and watch the morning fog pull back revealing a glass-like surface that mirrors the rolling hills above. Just 35 Miles from the new F-1 Track in Austin, 20 miles from SXSW and ACL Festival.","Internet, Air Conditioning, Hot Tub, Pets Welcome, Fireplace, TV, Satellite or Cable, Washer & Dryer, Children Welcome, Parking, No Smoking, Heater"
19,https://www.homeaway.com/vacation-rental/p346235#reviews,Spacious Historic Hyde Park Bungalow w/ Office in Central Austin by UT/Downtown,$100,780 sq. ft.,"This charming light-filled Hyde Park bungalow was built in 1915 and is rich in history. Remodeled in 2013 to maintain historic characteristics, it’s comprised of a large living room, full kitchen, a second bedroom with office space, and full bathroom with original antique claw foot tub/shower. Since the 1930's this house has been split into different residences. Enjoy this 780 square foot home that sleeps 3 adults. Other features include beautiful floors, 10-foot ceilings, a large fully fenced back yard, and fun vintage fixtures. It's within easy walking distance of multiple city and UT bus stops, Hyde Park restaurants, a bakery/coffee shop, Fresh Plus neighborhood grocery store, tennis courts, a park, and many other local Austin businesses. It's a great place to walk, ride bikes, or simply enjoy the quiet and relaxing atmosphere while being close to downtown.","Washer & Dryer, Air Conditioning, No Smoking, Satellite or Cable, TV, Children Welcome, Internet, Heater, Parking"
20,https://www.homeaway.com/vacation-rental/p350403#reviews,"Zilker Park Place--HUGE TOWNHOME- Fantastic Location--Comfy, Colorful, Peaceful",$125,950 sq. ft.,ZILKER PARK PLACE IS:,"Satellite or Cable, No Smoking, Washer & Dryer, Air Conditioning, TV, Children Welcome, Internet, Parking, Heater"
21,https://www.homeaway.com/vacation-rental/p3513280#reviews,SOCO - Private Upstairs Duplex - Walk Dntwn and to Lake (South Congress),$125,600 sq. ft.,"This is a new construction home with a private upstairs apartment. Between South First and SoCo within walkable proximity to some of the best restaurants and shopping in Austin. Walk to the trail, around the lake or walk downtown. Anywhere in Central Austin - Zilker Park, Barton Springs, East Austin, convention center, etc - is an inexpensive Lyft/Uber drive away. The bus also stops across South Congress from me.","Internet, Air Conditioning, TV, Satellite or Cable, Washer & Dryer, Children Welcome, Parking, No Smoking, Heater"
22,https://www.homeaway.com/vacation-rental/p1190588vb#reviews,Luxury Two-Story Guesthouse - Steps From Downtown And SOCO,$133,1100 sq. ft.,"Large (1,100 sq ft) casita in the heart of Austin. Perfect South First location for Austin traveler/vacationer in Bouldin Creek district. Enjoy an oasis of calm right in the middle of all the action -- just a 10 minute walk to bustling South Congress and a quick drive/leisurely stroll to all that Downtown offers. Some of Austin's top restaurants, including Lenoir, Mattie's at Green Pastures, and Winebelly are only a few blocks away!","No Smoking, Air Conditioning, Washer & Dryer, Satellite or Cable, TV, Children Welcome, Internet, Heater, Parking, Accessible"
23,https://www.homeaway.com/vacation-rental/p3468663#reviews,Park Lane Modern - Stunning 3br/3ba Home - Steps to South Congress!,$335,2000 sq. ft.,"3br/3ba rental in the heart of beautiful Travis Heights just east of South Congress Ave., where some of Austin's best shopping, eating and people-watching abound! Park Lane Modern is a contemporary home not lacking in warmth, and sleeping six comfortably in beds.","Internet, Air Conditioning, Pets Welcome, TV, Satellite or Cable, Washer & Dryer, Children Welcome, Parking, No Smoking, Heater"
24,https://www.homeaway.com/vacation-rental/p3584859#reviews,🌼The SoCo GuestHouse 2+/1 Up to 6 People -1 Blk to South Congress/.4 Downtown,$207,1000 sq. ft.,*Best Reviews in Austin! -The SoCo Guest House (Austin License #085385),"Internet, Air Conditioning, TV, Satellite or Cable, Children Welcome, Parking, No Smoking, Heater"
25,https://www.homeaway.com/vacation-rental/p374746vb#reviews,"Downtown Austin Apartment on W 6th – 3 Decks, Walk to Restaurants & More",$194,,"Tucked within minutes of downtown Austin’s major attractions, our 2BR, 2.5BA apartment (sleeps 4) offers the perfect blend of walkability and tranquility. Walk to restaurants, galleries and bars, then come home and relax on three decks shaded by oak trees.","Satellite or Cable, Washer & Dryer, No Smoking, Air Conditioning, TV, Internet"
26,https://www.homeaway.com/vacation-rental/p3473613#reviews,New Listing! Casita in rolling Texas Hill Country,$116,394 sq. ft.,"Entering the garden gate, you'll walk under an arbor and pass the chicken coop, the organic garden and enter your own private retreat. We have made every effort to make this retreat as green as possible. Just inside the gate you have a lovely patio shaded by native Live Oaks, another garden area planted with Texas Natives, and a large covered porch with an outdoor dining spot, and a wide bench with cushions. Inside the Casita, which is small and efficient, you have a queen sized bed, a love seat, a kitchen with granite counter tops and equipped with all the basics, an expandable dining table, a closet and a bath with walk in shower. There are handmade tiles installed in the kitchen and the bath. The dinnerware is from our studio. We We harvest rainwater and use it on the vegetable gardens, and use some for the landscaping. When available, we can supply you with some fresh eggs from the chickens and a vegetable or two from the garden. Just ask and we will harvest for you. The hot water heater is tankless on demand, the AC/heater is an energy efficient 18 Seer Mini-Split, and there is a ceiling fan to reduce the need for AC. The floors are hardwood and tile with an area rug in the living area. We use sustainable paper products, bath products and soaps. The furniture and cabinetry was locally sourced and/or reclaimed.","Swimming pool, Internet, Air Conditioning, Pets Welcome, TV, Washer & Dryer, Children Welcome, Parking, No Smoking, Heater"
27,https://www.homeaway.com/vacation-rental/p373731vb#reviews,2BR Bouldin Cottage Charmer in the True Heart of Soco!,$185,1100 sq. ft.,"Our 1948, 2BR cottage home has been completely remodeled and sits under a canopy of huge live oak trees. The cheerful kitchen has stainless steel appliances, granite countertops, gas cooking, and all the tools you need to cook your meals. There is also a French press, microwave oven, and toaster oven for breakfasts, and a good number of margarita and wine glasses just in case you need to unwind with friends after a long day of fun. The bed in the master bedroom has a deluxe pillow top mattress, lots of cozy pillows, and has linen sheets in the summer months and fleece in the few cooler months. The guest room features a second queen bed with plenty of pillows and crisp cotton sheets. The bathroom has also been fully updated. The living room has a flat screen TV, and a fireplace. It’s open to the kitchen, making for an easy layout to hang out with friends and family. After a long day of fun activities, come home to hang out and share a bottle of wine on the huge back deck under the live oaks, or relax on the front porch swing and watch neighbors walk by.","No Smoking, Air Conditioning, Washer & Dryer, Satellite or Cable, TV, Pets Welcome, Internet, Fireplace"
28,https://www.homeaway.com/vacation-rental/p3590408#reviews,"Lake Austin 3BR Mid-Century Modern - 200 Ft to Boat Slip, 10 Mins to Downtown",$532,2900 sq. ft.,"This welcoming 3BR/3BA home was uniquely designed for convenience, accessibility, and enjoyment. All three bedrooms are master suites, each with a beautiful en-suite bathroom.","Internet, Air Conditioning, TV, Satellite or Cable, Washer & Dryer, No Smoking"
29,https://www.homeaway.com/vacation-rental/p3655888#reviews,Casa de Miguel - 3BR/3BA Luxurious Beautifully Designed Family Home Soco,$225,1900 sq. ft.,"3br/3ba rental lies in the heart of south central Austin, near South Congress Ave. with ample options for eats and drinks. Casa de Miguel sleeps 8 comfortably in beds.","No Smoking, Air Conditioning, Washer & Dryer, Satellite or Cable, TV, Children Welcome, Pets Welcome, Internet, Heater, Parking"
30,https://www.homeaway.com/vacation-rental/p278724#reviews,"Comfy, cozy and quiet studio condo 2 blocks to Zilker Park. Sleeps 4.",$101,473 sq. ft.,"The Studio, our most affordable efficiency condo, is decorated with a ""music"" theme and has artwork and photos of Austin musicians. It has a 'James Bond' Queen bed with hidden pull-down arm rest and cup holders - along with Tempurpedic mattress and a Natuzi Queen sized pull out couch. There is a private porch with a table and 4 chairs. Gas grill is shared with The Sweet next door and is on the side of the building.","Satellite or Cable, No Smoking, Pets Welcome, Washer & Dryer, Air Conditioning, TV, Children Welcome, Internet, Parking, Heater"
31,https://www.homeaway.com/vacation-rental/p336924vb#reviews,"Formula 1, SXSW, ACL North Loop Rock Star Modern Home",$650,,"Ultramodern home in central Austin. Soaring ceilings, floor to ceiling glass walls and eclectic luxurious furnishings will enhance your Austin vacation or business experience. The newly constructed home is outfitted with vacation renters in mind. A large backyard 'parking lot' with four parking spaces is accessed through a private security gate. The kitchen is fully outfitted with all tools, utensils, cookware to prepare full family dinners.","Internet, Air Conditioning, TV, Satellite or Cable, Washer & Dryer, Children Welcome, No Smoking"
32,https://www.homeaway.com/vacation-rental/p3623340#reviews,"Bali Meets Austin In Artist's Spectacular, Private, Luxury Loft House",$790,3600 sq. ft.,"Welcome to the Loft House, winner of the ABC Living Well Channel's 'Sweet Retreats' Austin edition, also known as the ""Bali-inspired Artist's Retreat"".","Swimming pool, Internet, Air Conditioning, Fireplace, TV, Satellite or Cable, Washer & Dryer, Children Welcome, Parking, No Smoking, Heater"
33,https://www.homeaway.com/vacation-rental/p3522481#reviews,"Tranquil S Austin Gem with Comfy Beds, Big Yard, Close to Downtown",$227,1672 sq. ft.,"Located a few miles from South Congress, South Lamar, and downtown, this spacious South Austin home is designed for entertaining visitors of all ages as well as their beloved four-legged friends. The property is located near the South Austin intersection of William Cannon and Manchaca which is a short drive away from downtown along with many uniquely Austin restaurants, food trailers, shops, parks, and more. It allows visitors to experience Austin's creative and 'weird' landscape while maintaining a feeling of coziness that makes everyone feel welcome.","Internet, Air Conditioning, Pets Welcome, Fireplace, TV, Satellite or Cable, Washer & Dryer, Children Welcome, Parking, No Smoking, Heater"
